{
 "mock": true,
 "schema": "fig7-pourbaix/assumed-v0",
 "note": "MOCK: synthetic values to exercise the template; not a result",
 "regimes": [
  {
   "id": "regime-1",
   "conditions": {
    "note": "MOCK: synthetic values to exercise the template; not a result"
   },
   "ph_range": [
    0.0,
    14.0
   ],
   "potential_range": [
    -2.5,
    1.5
   ],
   "domains": [
    {
     "species": "mock-solid-1",
     "phase": "solid",
     "polygon": [
      [
       0.0,
       -2.5
      ],
      [
       14.0,
       -2.5
      ],
      [
       14.0,
       -2.44
      ],
      [
       0.0,
       -1.6
      ]
     ]
    },
    {
     "species": "mock-aqueous-1",
     "phase": "aqueous",
     "polygon": [
      [
       0.0,
       -1.6
      ],
      [
       4.0,
       -1.84
      ],
      [
       4.0,
       1.5
      ],
      [
       0.0,
       1.5
      ]
     ]
    },
    {
     "species": "mock-solid-2",
     "phase": "solid",
     "polygon": [
      [
       4.0,
       -1.84
      ],
      [
       8.6,
       -2.116
      ],
      [
       8.6,
       1.5
      ],
      [
       4.0,
       1.5
      ]
     ]
    },
    {
     "species": "mock-aqueous-2",
     "phase": "aqueous",
     "polygon": [
      [
       8.6,
       -2.116
      ],
      [
       14.0,
       -2.44
      ],
      [
       14.0,
       1.5
      ],
      [
       8.6,
       1.5
      ]
     ]
    }
   ],
   "water_lines": [
    {
     "kind": "upper",
     "points": [
      [
       0.0,
       1.2
      ],
      [
       14.0,
       0.36
      ]
     ]
    },
    {
     "kind": "lower",
     "points": [
      [
       0.0,
       0.0
      ],
      [
       14.0,
       -0.84
      ]
     ]
    }
   ]
  },
  {
   "id": "regime-2",
   "conditions": {
    "note": "MOCK: synthetic values to exercise the template; not a result"
   },
   "ph_range": [
    0.0,
    14.0
   ],
   "potential_range": [
    -2.5,
    1.5
   ],
   "domains": [
    {
     "species": "mock-solid-1",
     "phase": "solid",
     "polygon": [
      [
       0.0,
       -2.5
      ],
      [
       14.0,
       -2.5
      ],
      [
       14.0,
       -2.34
      ],
      [
       0.0,
       -1.5
      ]
     ]
    },
    {
     "species": "mock-aqueous-1",
     "phase": "aqueous",
     "polygon": [
      [
       0.0,
       -1.5
      ],
      [
       4.8,
       -1.788
      ],
      [
       4.8,
       1.5
      ],
      [
       0.0,
       1.5
      ]
     ]
    },
    {
     "species": "mock-solid-2",
     "phase": "solid",
     "polygon": [
      [
       4.8,
       -1.788
      ],
      [
       7.6,
       -1.956
      ],
      [
       7.6,
       1.5
      ],
      [
       4.8,
       1.5
      ]
     ]
    },
    {
     "species": "mock-aqueous-2",
     "phase": "aqueous",
     "polygon": [
      [
       7.6,
       -1.956
      ],
      [
       14.0,
       -2.34
      ],
      [
       14.0,
       1.5
      ],
      [
       7.6,
       1.5
      ]
     ]
    }
   ],
   "water_lines": [
    {
     "kind": "upper",
     "points": [
      [
       0.0,
       1.2
      ],
      [
       14.0,
       0.36
      ]
     ]
    },
    {
     "kind": "lower",
     "points": [
      [
       0.0,
       0.0
      ],
      [
       14.0,
       -0.84
      ]
     ]
    }
   ]
  }
 ]
}
